{
  "name": "SideNavItems",
  "level": 2,
  "status": "stable",
  "category": "carbon",
  "summary": "Carbon SideNavItems.",
  "variants": {},
  "props": [
    {
      "name": "isSideNavExpanded",
      "required": false,
      "type": "boolean",
      "description": "Property to indicate if the side nav container is open (or not). Use to keep local state and styling in step with the SideNav expansion state."
    }
  ],
  "tokens_used": [
    "semantic.*"
  ],
  "a11y": {
    "contrast": "WCAG 2.2 AA — inherited from Carbon",
    "note": "Carbon ships a11y behaviour per component; verify per screen"
  },
  "when_to_use": "Use Carbon SideNavItems rather than building one.",
  "when_not_to_use": "Do not restyle off-token — propose a token instead.",
  "source": "@carbon/react@1.115.0 (package/es/components/UIShell/SideNavItems.d.ts) — Apache-2.0",
  "parse": {
    "interface": "SideNavItemsProps",
    "kind": "full",
    "partial": false,
    "prop_count": 1,
    "variant_count": 0
  }
}
