{
  "name": "ButtonSet",
  "level": 2,
  "status": "stable",
  "category": "carbon",
  "summary": "Carbon ButtonSet.",
  "variants": {},
  "props": [
    {
      "name": "fluid",
      "required": false,
      "type": "boolean",
      "description": "fluid: button set resize to the size of the container up to a maximum dependant on the number of buttons. Overrides `stacked` property."
    },
    {
      "name": "stacked",
      "required": false,
      "type": "boolean",
      "description": "Specify the button arrangement of the set (vertically stacked or horizontal)"
    }
  ],
  "tokens_used": [
    "semantic.*"
  ],
  "a11y": {
    "contrast": "WCAG 2.2 AA — inherited from Carbon",
    "note": "Carbon ships a11y behaviour per component; verify per screen"
  },
  "when_to_use": "Use Carbon ButtonSet rather than building one.",
  "when_not_to_use": "Do not restyle off-token — propose a token instead.",
  "source": "@carbon/react@1.115.0 (package/es/components/ButtonSet/ButtonSet.d.ts) — Apache-2.0",
  "parse": {
    "interface": "ButtonSetProps",
    "kind": "full",
    "partial": false,
    "prop_count": 2,
    "variant_count": 0
  }
}
