{
  "name": "MenuItemDivider",
  "level": 2,
  "status": "stable",
  "category": "carbon",
  "summary": "Carbon MenuItemDivider.",
  "variants": {
    "backgroundToken": [
      "layer",
      "background"
    ],
    "mode": [
      "full",
      "basic"
    ],
    "size": [
      "xs",
      "sm",
      "md",
      "lg"
    ]
  },
  "props": [
    {
      "name": "backgroundToken",
      "required": false,
      "type": "'layer' | 'background'",
      "description": "Specify the background token to use. Default is 'layer'."
    },
    {
      "name": "border",
      "required": false,
      "type": "boolean",
      "description": "Specify whether a border should be rendered on the popover"
    },
    {
      "name": "containerRef",
      "required": false,
      "type": "RefObject<HTMLDivElement | null>",
      "description": "The ref of the containing element, used for positioning and alignment of the menu"
    },
    {
      "name": "label",
      "required": true,
      "type": "string",
      "description": "A label describing the Menu."
    },
    {
      "name": "legacyAutoalign",
      "required": false,
      "type": "boolean",
      "description": null
    },
    {
      "name": "menuAlignment",
      "required": false,
      "type": "string",
      "description": "Specify how the menu should align with the button element"
    },
    {
      "name": "mode",
      "required": false,
      "type": "'full' | 'basic'",
      "description": "The mode of this menu. Defaults to full. `full` supports nesting and selectable menu items, but no icons. `basic` supports icons but no nesting or selectable menu items. **This prop is not intended for use and will be set by the respective implementation (like useContextMenu, MenuButton, and ComboButton).**"
    },
    {
      "name": "open",
      "required": false,
      "type": "boolean",
      "description": "Whether the Menu is open or not."
    },
    {
      "name": "size",
      "required": false,
      "type": "'xs' | 'sm' | 'md' | 'lg'",
      "description": "Specify the size of the Menu."
    },
    {
      "name": "target",
      "required": false,
      "type": "Element",
      "description": "Specify a DOM node where the Menu should be rendered in. Defaults to document.body."
    },
    {
      "name": "x",
      "required": false,
      "type": "number | [number, number]",
      "description": "Specify the x position of the Menu. Either pass a single number or an array with two numbers describing your activator's boundaries ([x1, x2])"
    },
    {
      "name": "y",
      "required": false,
      "type": "number | [number, number]",
      "description": "Specify the y position of the Menu. Either pass a single number or an array with two numbers describing your activator's boundaries ([y1, y2])"
    }
  ],
  "tokens_used": [
    "semantic.*"
  ],
  "a11y": {
    "contrast": "WCAG 2.2 AA — inherited from Carbon",
    "note": "Carbon ships a11y behaviour per component; verify per screen"
  },
  "when_to_use": "Use Carbon MenuItemDivider rather than building one.",
  "when_not_to_use": "Do not restyle off-token — propose a token instead.",
  "source": "@carbon/react@1.115.0 (package/es/components/Menu/Menu.d.ts) — Apache-2.0",
  "parse": {
    "interface": "MenuProps",
    "kind": "full",
    "partial": false,
    "prop_count": 12,
    "variant_count": 3
  }
}
