{
  "name": "TableExpandRow",
  "level": 2,
  "status": "stable",
  "category": "carbon",
  "summary": "Carbon TableExpandRow.",
  "variants": {},
  "props": [
    {
      "name": "ariaLabel",
      "required": false,
      "type": "string",
      "description": "Space separated list of one or more ID values referencing the TableExpandedRow(s) being controlled by the TableExpandRow / 'aria-controls'?: string; /** removed in the next major release of Carbon. Use the `aria-label` prop instead."
    },
    {
      "name": "expandHeader",
      "required": false,
      "type": "string",
      "description": "Specify the string read by a voice reader when the expand trigger is focused / 'aria-label': string; /** The id of the matching th node in the table head. Addresses a11y concerns outlined here: https://www.ibm.com/able/guidelines/ci162/info_and_relationships.html and https://www.w3.org/TR/WCAG20-TECHS/H43"
    },
    {
      "name": "expandIconDescription",
      "required": false,
      "type": "string",
      "description": "The description of the chevron right icon, to be put in its SVG `<title>` element."
    },
    {
      "name": "isExpanded",
      "required": false,
      "type": "boolean",
      "description": "Specify whether this row is expanded or not. This helps coordinate data attributes so that `TableExpandRow` and `TableExpandedRow` work together"
    }
  ],
  "tokens_used": [
    "semantic.*"
  ],
  "a11y": {
    "contrast": "WCAG 2.2 AA — inherited from Carbon",
    "note": "Carbon ships a11y behaviour per component; verify per screen"
  },
  "when_to_use": "Use Carbon TableExpandRow rather than building one.",
  "when_not_to_use": "Do not restyle off-token — propose a token instead.",
  "source": "@carbon/react@1.115.0 (package/es/components/DataTable/TableExpandRow.d.ts) — Apache-2.0",
  "parse": {
    "interface": "TableExpandRowProps",
    "kind": "full",
    "partial": false,
    "prop_count": 4,
    "variant_count": 0
  }
}
