{
  "name": "TableToolbar",
  "level": 2,
  "status": "stable",
  "category": "carbon",
  "summary": "Carbon TableToolbar.",
  "variants": {
    "size": [
      "xs",
      "sm",
      "lg"
    ]
  },
  "props": [
    {
      "name": "ariaLabel",
      "required": false,
      "type": "string",
      "description": "Specify a label to be read by screen readers on the container node 'aria-label' of the TableToolbar component. / ['aria-label']?: string; /** 'aria-label' of the TableToolbar component."
    },
    {
      "name": "size",
      "required": false,
      "type": "'xs' | 'sm' | 'lg'",
      "description": "`lg` Change the row height of table"
    }
  ],
  "tokens_used": [
    "semantic.*"
  ],
  "a11y": {
    "contrast": "WCAG 2.2 AA — inherited from Carbon",
    "note": "Carbon ships a11y behaviour per component; verify per screen"
  },
  "when_to_use": "Use Carbon TableToolbar rather than building one.",
  "when_not_to_use": "Do not restyle off-token — propose a token instead.",
  "source": "@carbon/react@1.115.0 (package/es/components/DataTable/TableToolbar.d.ts) — Apache-2.0",
  "parse": {
    "interface": "TableToolbarProps",
    "kind": "full",
    "partial": false,
    "prop_count": 2,
    "variant_count": 1
  },
  "figma": {
    "node": "https://www.figma.com/design/YAnB1jKx0yCUL29j6uSLpg/(v11)-All-themes---Carbon-Design-System?node-id=4487-180741&t=T1B0YRZ6hK2IkVMC-4",
    "code_connect": "packages/react/code-connect/DataTable/TableToolbar.figma.tsx"
  }
}
