{
  "name": "ModalBody",
  "level": 2,
  "status": "stable",
  "category": "carbon",
  "summary": "Carbon ModalBody.",
  "variants": {},
  "props": [
    {
      "name": "hasForm",
      "required": false,
      "type": "boolean",
      "description": "Provide whether the modal content has a form element. If `true` is used here, non-form child content should have `cds--modal-content__regular-content` class."
    },
    {
      "name": "hasScrollingContent",
      "required": false,
      "type": "boolean",
      "description": "Specify whether the modal contains scrolling content"
    }
  ],
  "tokens_used": [
    "semantic.*"
  ],
  "a11y": {
    "contrast": "WCAG 2.2 AA — inherited from Carbon",
    "note": "Carbon ships a11y behaviour per component; verify per screen"
  },
  "when_to_use": "Use Carbon ModalBody rather than building one.",
  "when_not_to_use": "Do not restyle off-token — propose a token instead.",
  "source": "@carbon/react@1.115.0 (package/es/components/ComposedModal/ComposedModal.d.ts) — Apache-2.0",
  "parse": {
    "interface": "ModalBodyProps",
    "kind": "full",
    "partial": false,
    "prop_count": 2,
    "variant_count": 0
  }
}
