{
  "name": "preview__FluidNumberInput",
  "level": 2,
  "status": "preview",
  "category": "carbon",
  "summary": "Carbon preview__FluidNumberInput.",
  "variants": {
    "type": [
      "number",
      "text"
    ]
  },
  "props": [
    {
      "name": "allowEmpty",
      "required": false,
      "type": "boolean",
      "description": "`true` to allow empty string."
    },
    {
      "name": "defaultValue",
      "required": false,
      "type": "number | string",
      "description": "Optional starting value for uncontrolled state"
    },
    {
      "name": "disableWheel",
      "required": false,
      "type": "boolean",
      "description": "Specify if the wheel functionality for the input should be disabled, or not"
    },
    {
      "name": "disabled",
      "required": false,
      "type": "boolean",
      "description": "Specify if the control should be disabled, or not"
    },
    {
      "name": "formatOptions",
      "required": false,
      "type": "NumberFormatOptions",
      "description": "**Experimental:** Specify Intl.NumberFormat options applied to internal number parsing and formatting. Use with `type=\"text\"`, has no effect when `type=\"number\"`."
    },
    {
      "name": "iconDescription",
      "required": false,
      "type": "string",
      "description": "Provide a description for up/down icons that can be read by screen readers"
    },
    {
      "name": "inputMode",
      "required": false,
      "type": "React.HTMLAttributes<HTMLInputElement>['inputMode']",
      "description": "Instruct the browser which keyboard to display on mobile devices. Defaults to `decimal`, but note that standard numeric keyboards vary across devices and operating systems."
    },
    {
      "name": "invalid",
      "required": false,
      "type": "boolean",
      "description": "Specify if the currently value is invalid."
    },
    {
      "name": "invalidText",
      "required": false,
      "type": "React.ReactNode",
      "description": "Message which is displayed if the value is invalid."
    },
    {
      "name": "label",
      "required": false,
      "type": "React.ReactNode",
      "description": "Generic `label` that will be used as the textual representation of what this field is for"
    },
    {
      "name": "locale",
      "required": false,
      "type": "string",
      "description": "**Experimental:** Specify a [BCP47](https://www.ietf.org/rfc/bcp/bcp47.txt) language code for parsing and formatting. Use with `type=\"text\"`, has no effect when `type=\"number\"`."
    },
    {
      "name": "max",
      "required": false,
      "type": "number",
      "description": "The maximum value."
    },
    {
      "name": "min",
      "required": false,
      "type": "number",
      "description": "The minimum value."
    },
    {
      "name": "pattern",
      "required": false,
      "type": "string",
      "description": "When type=\"text\", provide an optional pattern to restrict user input. Has no effect when type=\"number\"."
    },
    {
      "name": "readOnly",
      "required": false,
      "type": "boolean",
      "description": "Whether or not the component is readonly"
    },
    {
      "name": "step",
      "required": false,
      "type": "number",
      "description": "Specify how much the values should increase/decrease upon clicking on up/down button"
    },
    {
      "name": "type",
      "required": false,
      "type": "'number' | 'text'",
      "description": "**Experimental**: Specify if the input should be of type text or number. Use type=\"text\" with `locale`, `formatOptions`, and guide user input with `pattern` and `inputMode`."
    },
    {
      "name": "value",
      "required": false,
      "type": "number | string",
      "description": "Specify the value of the input"
    },
    {
      "name": "warn",
      "required": false,
      "type": "boolean",
      "description": "Specify whether the control is currently in warning state"
    },
    {
      "name": "warnText",
      "required": false,
      "type": "React.ReactNode",
      "description": "Provide the text that is displayed when the control is in warning state"
    }
  ],
  "tokens_used": [
    "semantic.*"
  ],
  "a11y": {
    "contrast": "WCAG 2.2 AA — inherited from Carbon",
    "note": "Carbon ships a11y behaviour per component; verify per screen"
  },
  "when_to_use": "Use Carbon preview__FluidNumberInput rather than building one.",
  "when_not_to_use": "Do not restyle off-token — propose a token instead.",
  "source": "@carbon/react@1.115.0 (package/es/components/FluidNumberInput/FluidNumberInput.d.ts) — Apache-2.0",
  "parse": {
    "interface": "FluidNumberInputProps",
    "kind": "full",
    "partial": false,
    "prop_count": 20,
    "variant_count": 1
  }
}
