{
  "name": "SkipToContent",
  "level": 2,
  "status": "stable",
  "category": "carbon",
  "summary": "Carbon SkipToContent.",
  "variants": {},
  "props": [],
  "tokens_used": [
    "semantic.*"
  ],
  "a11y": {
    "contrast": "WCAG 2.2 AA — inherited from Carbon",
    "note": "Carbon ships a11y behaviour per component; verify per screen"
  },
  "when_to_use": "Use Carbon SkipToContent rather than building one.",
  "when_not_to_use": "Do not restyle off-token — propose a token instead.",
  "source": "@carbon/react@1.115.0 (package/es/components/UIShell/SkipToContent.d.ts) — Apache-2.0",
  "parse": {
    "interface": null,
    "kind": "unparsed",
    "partial": true,
    "prop_count": 0,
    "variant_count": 0
  }
}
