{
  "name": "preview_TextDirection",
  "level": 2,
  "status": "stable",
  "category": "carbon",
  "summary": "Carbon preview_TextDirection.",
  "variants": {},
  "props": [
    {
      "name": "dir",
      "required": false,
      "type": "TextDir",
      "description": null
    }
  ],
  "tokens_used": [
    "semantic.*"
  ],
  "a11y": {
    "contrast": "WCAG 2.2 AA — inherited from Carbon",
    "note": "Carbon ships a11y behaviour per component; verify per screen"
  },
  "when_to_use": "Use Carbon preview_TextDirection rather than building one.",
  "when_not_to_use": "Do not restyle off-token — propose a token instead.",
  "source": "@carbon/react@1.115.0 (package/es/components/Text/Text.d.ts) — Apache-2.0",
  "parse": {
    "interface": "TextBaseProps",
    "kind": "full",
    "partial": false,
    "prop_count": 1,
    "variant_count": 0
  }
}
