{
  "name": "SideNavSwitcher",
  "level": 2,
  "status": "stable",
  "category": "carbon",
  "summary": "Carbon SideNavSwitcher.",
  "variants": {},
  "props": [
    {
      "name": "labelText",
      "required": true,
      "type": "string",
      "description": "Provide the label for the switcher. This will be the first visible option when someone views this control"
    },
    {
      "name": "options",
      "required": true,
      "type": "string[]",
      "description": "Provide an array of options to be rendered in the switcher as an `<option>`. The text value will be what is displayed to the user and is set as the `value` prop for each `<option>`."
    }
  ],
  "tokens_used": [
    "semantic.*"
  ],
  "a11y": {
    "contrast": "WCAG 2.2 AA — inherited from Carbon",
    "note": "Carbon ships a11y behaviour per component; verify per screen"
  },
  "when_to_use": "Use Carbon SideNavSwitcher rather than building one.",
  "when_not_to_use": "Do not restyle off-token — propose a token instead.",
  "source": "@carbon/react@1.115.0 (package/es/components/UIShell/SideNavSwitcher.d.ts) — Apache-2.0",
  "parse": {
    "interface": "SideNavSwitcherProps",
    "kind": "full",
    "partial": false,
    "prop_count": 2,
    "variant_count": 0
  }
}
